{"compiler":{"version":"0.8.22+commit.4fc1097e"},"language":"Solidity","output":{"abi":[{"inputs":[{"internalType":"address","name":"spender","type":"address"},{"internalType":"uint256","name":"allowance","type":"uint256"},{"internalType":"uint256","name":"needed","type":"uint256"}],"name":"ERC20InsufficientAllowance","type":"error"},{"inputs":[{"internalType":"address","name":"sender","type":"address"},{"internalType":"uint256","name":"balance","type":"uint256"},{"internalType":"uint256","name":"needed","type":"uint256"}],"name":"ERC20InsufficientBalance","type":"error"},{"inputs":[{"internalType":"address","name":"approver","type":"address"}],"name":"ERC20InvalidApprover","type":"error"},{"inputs":[{"internalType":"address","name":"receiver","type":"address"}],"name":"ERC20InvalidReceiver","type":"error"},{"inputs":[{"internalType":"address","name":"sender","type":"address"}],"name":"ERC20InvalidSender","type":"error"},{"inputs":[{"internalType":"address","name":"spender","type":"address"}],"name":"ERC20InvalidSpender","type":"error"}],"devdoc":{"details":"Standard ERC20 Errors Interface of the https://eips.ethereum.org/EIPS/eip-6093[ERC-6093] custom errors for ERC20 tokens.","errors":{"ERC20InsufficientAllowance(address,uint256,uint256)":[{"details":"Indicates a failure with the `spender`\u2019s `allowance`. Used in transfers.","params":{"allowance":"Amount of tokens a `spender` is allowed to operate with.","needed":"Minimum amount required to perform a transfer.","spender":"Address that may be allowed to operate on tokens without being their owner."}}],"ERC20InsufficientBalance(address,uint256,uint256)":[{"details":"Indicates an error related to the current `balance` of a `sender`. Used in transfers.","params":{"balance":"Current balance for the interacting account.","needed":"Minimum amount required to perform a transfer.","sender":"Address whose tokens are being transferred."}}],"ERC20InvalidApprover(address)":[{"details":"Indicates a failure with the `approver` of a token to be approved. Used in approvals.","params":{"approver":"Address initiating an approval operation."}}],"ERC20InvalidReceiver(address)":[{"details":"Indicates a failure with the token `receiver`. Used in transfers.","params":{"receiver":"Address to which tokens are being transferred."}}],"ERC20InvalidSender(address)":[{"details":"Indicates a failure with the token `sender`. Used in transfers.","params":{"sender":"Address whose tokens are being transferred."}}],"ERC20InvalidSpender(address)":[{"details":"Indicates a failure with the `spender` to be approved. Used in approvals.","params":{"spender":"Address that may be allowed to operate on tokens without being their owner."}}]},"kind":"dev","methods":{},"version":1},"userdoc":{"kind":"user","methods":{},"version":1}},"settings":{"compilationTarget":{"/home/piatoss/go-ethereum/node_modules/@openzeppelin/contracts/interfaces/draft-IERC6093.sol":"IERC20Errors"},"evmVersion":"shanghai","libraries":{},"metadata":{"bytecodeHash":"ipfs","useLiteralContent":true},"optimizer":{"enabled":true,"runs":200},"remappings":[":@openzeppelin/=/home/piatoss/go-ethereum/node_modules/@openzeppelin/"]},"sources":{"/home/piatoss/go-ethereum/node_modules/@openzeppelin/contracts/interfaces/draft-IERC6093.sol":{"content":"// SPDX-License-Identifier: MIT\n// OpenZeppelin Contracts (last updated v5.0.0) (interfaces/draft-IERC6093.sol)\npragma solidity ^0.8.20;\n\n/**\n * @dev Standard ERC20 Errors\n * Interface of the https://eips.ethereum.org/EIPS/eip-6093[ERC-6093] custom errors for ERC20 tokens.\n */\ninterface IERC20Errors {\n    /**\n     * @dev Indicates an error related to the current `balance` of a `sender`. Used in transfers.\n     * @param sender Address whose tokens are being transferred.\n     * @param balance Current balance for the interacting account.\n     * @param needed Minimum amount required to perform a transfer.\n     */\n    error ERC20InsufficientBalance(address sender, uint256 balance, uint256 needed);\n\n    /**\n     * @dev Indicates a failure with the token `sender`. Used in transfers.\n     * @param sender Address whose tokens are being transferred.\n     */\n    error ERC20InvalidSender(address sender);\n\n    /**\n     * @dev Indicates a failure with the token `receiver`. Used in transfers.\n     * @param receiver Address to which tokens are being transferred.\n     */\n    error ERC20InvalidReceiver(address receiver);\n\n    /**\n     * @dev Indicates a failure with the `spender`\u2019s `allowance`. Used in transfers.\n     * @param spender Address that may be allowed to operate on tokens without being their owner.\n     * @param allowance Amount of tokens a `spender` is allowed to operate with.\n     * @param needed Minimum amount required to perform a transfer.\n     */\n    error ERC20InsufficientAllowance(address spender, uint256 allowance, uint256 needed);\n\n    /**\n     * @dev Indicates a failure with the `approver` of a token to be approved. Used in approvals.\n     * @param approver Address initiating an approval operation.\n     */\n    error ERC20InvalidApprover(address approver);\n\n    /**\n     * @dev Indicates a failure with the `spender` to be approved. Used in approvals.\n     * @param spender Address that may be allowed to operate on tokens without being their owner.\n     */\n    error ERC20InvalidSpender(address spender);\n}\n\n/**\n * @dev Standard ERC721 Errors\n * Interface of the https://eips.ethereum.org/EIPS/eip-6093[ERC-6093] custom errors for ERC721 tokens.\n */\ninterface IERC721Errors {\n    /**\n     * @dev Indicates that an address can't be an owner. For example, `address(0)` is a forbidden owner in EIP-20.\n     * Used in balance queries.\n     * @param owner Address of the current owner of a token.\n     */\n    error ERC721InvalidOwner(address owner);\n\n    /**\n     * @dev Indicates a `tokenId` whose `owner` is the zero address.\n     * @param tokenId Identifier number of a token.\n     */\n    error ERC721NonexistentToken(uint256 tokenId);\n\n    /**\n     * @dev Indicates an error related to the ownership over a particular token. Used in transfers.\n     * @param sender Address whose tokens are being transferred.\n     * @param tokenId Identifier number of a token.\n     * @param owner Address of the current owner of a token.\n     */\n    error ERC721IncorrectOwner(address sender, uint256 tokenId, address owner);\n\n    /**\n     * @dev Indicates a failure with the token `sender`. Used in transfers.\n     * @param sender Address whose tokens are being transferred.\n     */\n    error ERC721InvalidSender(address sender);\n\n    /**\n     * @dev Indicates a failure with the token `receiver`. Used in transfers.\n     * @param receiver Address to which tokens are being transferred.\n     */\n    error ERC721InvalidReceiver(address receiver);\n\n    /**\n     * @dev Indicates a failure with the `operator`\u2019s approval. Used in transfers.\n     * @param operator Address that may be allowed to operate on tokens without being their owner.\n     * @param tokenId Identifier number of a token.\n     */\n    error ERC721InsufficientApproval(address operator, uint256 tokenId);\n\n    /**\n     * @dev Indicates a failure with the `approver` of a token to be approved. Used in approvals.\n     * @param approver Address initiating an approval operation.\n     */\n    error ERC721InvalidApprover(address approver);\n\n    /**\n     * @dev Indicates a failure with the `operator` to be approved. Used in approvals.\n     * @param operator Address that may be allowed to operate on tokens without being their owner.\n     */\n    error ERC721InvalidOperator(address operator);\n}\n\n/**\n * @dev Standard ERC1155 Errors\n * Interface of the https://eips.ethereum.org/EIPS/eip-6093[ERC-6093] custom errors for ERC1155 tokens.\n */\ninterface IERC1155Errors {\n    /**\n     * @dev Indicates an error related to the current `balance` of a `sender`. Used in transfers.\n     * @param sender Address whose tokens are being transferred.\n     * @param balance Current balance for the interacting account.\n     * @param needed Minimum amount required to perform a transfer.\n     * @param tokenId Identifier number of a token.\n     */\n    error ERC1155InsufficientBalance(address sender, uint256 balance, uint256 needed, uint256 tokenId);\n\n    /**\n     * @dev Indicates a failure with the token `sender`. Used in transfers.\n     * @param sender Address whose tokens are being transferred.\n     */\n    error ERC1155InvalidSender(address sender);\n\n    /**\n     * @dev Indicates a failure with the token `receiver`. Used in transfers.\n     * @param receiver Address to which tokens are being transferred.\n     */\n    error ERC1155InvalidReceiver(address receiver);\n\n    /**\n     * @dev Indicates a failure with the `operator`\u2019s approval. Used in transfers.\n     * @param operator Address that may be allowed to operate on tokens without being their owner.\n     * @param owner Address of the current owner of a token.\n     */\n    error ERC1155MissingApprovalForAll(address operator, address owner);\n\n    /**\n     * @dev Indicates a failure with the `approver` of a token to be approved. Used in approvals.\n     * @param approver Address initiating an approval operation.\n     */\n    error ERC1155InvalidApprover(address approver);\n\n    /**\n     * @dev Indicates a failure with the `operator` to be approved. Used in approvals.\n     * @param operator Address that may be allowed to operate on tokens without being their owner.\n     */\n    error ERC1155InvalidOperator(address operator);\n\n    /**\n     * @dev Indicates an array length mismatch between ids and values in a safeBatchTransferFrom operation.\n     * Used in batch transfers.\n     * @param idsLength Length of the array of token identifiers\n     * @param valuesLength Length of the array of token amounts\n     */\n    error ERC1155InvalidArrayLength(uint256 idsLength, uint256 valuesLength);\n}\n","keccak256":"0x60c65f701957fdd6faea1acb0bb45825791d473693ed9ecb34726fdfaa849dd7","license":"MIT"}},"version":1}